Year,Title
2014,stochastic inference for scalable probabilistic modeling of binary matrices.
2014,elementary estimators for high-dimensional linear regression.
2014,elementary estimators for sparse covariance matrices and other structured moments.
2014,graph-based semi-supervised learning: realizing pointwise smoothness probabilistically.
2014,bayesian max-margin multi-task learning with data augmentation.
2014,sparse reinforcement learning via convex optimization.
2014,gaussian process classification and active learning with multiple annotators.
2014,structured prediction of network response.
2014,an analysis of state-relevance weights and sampling distributions on l1-regularized approximate linear programming approximation accuracy.
2014,optimization equivalence of divergences improves neighbor embedding.
2014,an asynchronous parallel stochastic coordinate descent algorithm.
2014,consistency of causal inference under the additive noise model.
2014,globally convergent parallel map lp relaxation solver using the frank-wolfe algorithm.
2014,linear programming for large-scale markov decision problems.
2014,linear time solver for primal svm.
2014,memory (and time) efficient sequential monte carlo.
2014,scaling svm and least absolute deviations via exact data reduction.
2014,latent semantic representation learning for scene classification.
2014,least squares revisited: scalable approaches for multi-class prediction.
2014,local algorithms for interactive clustering.
2014,model-based relational rl when object existence is partially observable.
2014,a new q(lambda) with interim forward view and monte carlo equivalence.
2014,on robustness and regularization of structural support vector machines.
2014,guess-averse loss functions for cost-sensitive multiclass boosting.
2014,multimodal neural language models.
2014,fast large-scale optimization by unifying stochastic gradient and quasi-newton methods.
2014,alternating minimization for mixed linear regression.
2014,stochastic neighbor compression.
2014,robust learning under uncertain test distributions: relating covariate shift to model misspecification.
2014,nonparametric estimation of multi-view latent variable models.
2014,structured generative models of natural source code.
2014,a single-pass algorithm for efficiently recovering sparse cluster centers of high-dimensional data.
2014,statistical analysis of stochastic gradient methods for generalized linear models.
2014,coding for random projections.
2014,fast computation of wasserstein barycenters.
2014,global graph kernels using geometric embeddings.
2014,"topic modeling using topics from many domains, lifelong learning and big data."
2014,k-means recovers ica filters when independent components are sparse.
2014,learning mixtures of linear classifiers.
2014,the falling factorial basis and its statistical applications.
2014,nonmyopic \(\epsilon\)-bayes-optimal active learning of gaussian processes.
2014,a unifying view of representer theorems.
2014,online clustering of bandits.
2014,cold-start active learning with robust ordinal matrix factorization.
2014,multivariate maximal correlation analysis.
2014,efficient label propagation.
2014,"estimating diffusion network structures: recovery conditions, sample complexity & soft-thresholding algorithm."
2014,coupled group lasso for web-scale ctr prediction in display advertising.
2014,putting mrfs on a tensor train.
2014,efficient algorithms for robust one-bit compressive sensing.
2014,learning complex neural network policies with trajectory optimization.
2014,composite quantization for approximate nearest neighbor search.
2014,local ordinal embedding.
2014,reducing dueling bandits to cardinal bandits.
2014,large-margin weakly supervised dimensionality reduction.
2014,joint inference of multiple label types in large networks.
2014,hard-margin active linear regression.
2014,maximum margin multiclass nearest neighbors.
2014,combinatorial partial monitoring game with linear feedback and its applications.
2014,sparse meta-gaussian information bottleneck.
2014,nonparametric estimation of renyi divergence and friends.
2014,robust inverse covariance estimation under noisy measurements.
2014,bayesian optimization with inequality constraints.
2014,circulant binary embedding.
2014,multiple testing under dependence via semiparametric graphical models.
2014,making fisher discriminant analysis scalable.
2014,hierarchical dirichlet scaling process.
2014,approximation analysis of stochastic gradient langevin dynamics by using fokker-planck equation and ito process.
2014,a pac-bayesian bound for lifelong learning.
2014,communication-efficient distributed optimization using an approximate newton-type method.
2014,concept drift detection through resampling.
2014,"anti-differentiating approximation algorithms: a case study with min-cuts, spectral, and flow."
2014,a bayesian wilcoxon signed-rank test based on the dirichlet process.
2014,min-max problems on factor graphs.
2014,distributed stochastic gradient mcmc.
2014,nearest neighbors using compact sparse codes.
2014,optimal mean robust principal component analysis.
2014,preference-based rank elicitation using statistical models: the case of mallows.
2014,hierarchical conditional random fields for outlier detection: an application to detecting epileptogenic cortical malformations.
2014,a physics-based model prior for object-oriented mdps.
2014,outlier path: a homotopy algorithm for robust svm.
2014,ensemble-based tracking: aggregating crowdsourced structured time series data.
2014,latent confusion analysis by normalized gamma construction.
2014,"finito: a faster, permutable incremental gradient method for big data problems."
2014,ensemble methods for structured prediction.
2014,standardized mutual information for clustering comparisons: one step further in adjustment for chance.
2014,preserving modes and messages via diverse particle selection.
2014,nonlinear information-theoretic compressive measurement design.
2014,dual query: practical private query release for high dimensional data.
2014,deep boosting.
2014,distributed representations of sentences and documents.
2014,understanding protein dynamics with l1-regularized reversible hidden markov models.
2014,online multi-task learning for policy gradient methods.
2014,affinity weighted embedding.
2014,learning the parameters of determinantal point process kernels.
2014,discrete chebyshev classifiers.
2014,deep autoregressive networks.
2014,"a convergence rate analysis for logitboost, mart and their variant."
2014,inferning with high girth graphical models.
2014,learning latent variable gaussian graphical models.
2014,stochastic backpropagation and approximate inference in deep generative models.
2014,one practical algorithm for both stochastic and adversarial bandits.
2014,robust and efficient kernel hyperparameter paths with guarantees.
2014,active transfer learning under model shift.
2014,approximate policy iteration schemes: a comparison.
2014,stable and efficient representation learning with nonnegativity constraints.
2014,sample efficient reinforcement learning with gaussian processes.
2014,memory and computation efficient pca via very sparse random projections.
2014,time-regularized interrupting options (trio).
2014,randomized nonlinear component analysis.
2014,high order regularization for semi-supervised learning of structured output problems.
2014,transductive learning with multi-class volume approximation.
2014,methods of moments for learning stochastic languages: unified presentation and empirical comparison.
2014,effective bayesian modeling of groups of related count time series.
2014,variational inference for sequential distance dependent chinese restaurant process.
2014,discovering latent network structure in point process data.
2014,a kernel independence test for random processes.
2014,learning to disentangle factors of variation with manifold interaction.
2014,learning modular structures from network data and node variables.
2014,probabilistic partial canonical correlation analysis.
2014,skip context tree switching.
2014,lower bounds for the gibbs sampler over mixtures of gaussians.
2014,marginalized denoising auto-encoders for nonlinear representations.
2014,gaussian processes for bayesian estimation in ordinary differential equations.
2014,fast multi-stage submodular maximization.
2014,programming by feedback.
2014,probabilistic matrix factorization with non-random missing data.
2014,"pursuit-evasion without regret, with an application to trading."
2014,the f-adjusted graph laplacian: a diagonal modification with a geometric interpretation.
2014,riemannian pursuit for big matrix recovery.
2014,dynamic programming boosting for discriminative macro-action discovery.
2014,online stochastic optimization under correlated bandit feedback.
2014,weighted graph clustering with non-uniform uncertainties.
2014,genga: a generalization of natural gradient ascent with positive and negative convergence results.
2014,a bayesian framework for online classifier ensemble.
2014,adaptivity and optimism: an improved exponentiated gradient algorithm.
2014,gaussian approximation of collective graphical models.
2014,on learning to localize objects with minimal supervision.
2014,multiresolution matrix factorization.
2014,learnability of the superset label learning problem.
2014,taming the monster: a fast and simple algorithm for contextual bandits.
2014,structured recurrent temporal restricted boltzmann machines.
2014,scalable and robust bayesian inference via the median posterior.
2014,kernel adaptive metropolis-hastings.
2014,input warping for bayesian optimization of non-stationary functions.
2014,stochastic gradient hamiltonian monte carlo.
2014,a deep semi-nmf model for learning hidden representations.
2014,asynchronous distributed admm for consensus optimization.
2014,spectral regularization for max-margin sequence tagging.
2014,learning by stretching deep networks.
2014,nonnegative sparse pca with provable guarantees.
2014,active learning of parameterized skills.
2014,learning ordered representations with nested dropout.
2014,learning the irreducible representations of commutative lie groups.
2014,towards end-to-end speech recognition with recurrent neural networks.
2014,multi-period trading prediction markets with connections to machine learning.
2014,efficient gradient-based inference through transformations between bayes nets and neural nets.
2014,neural variational inference and learning in belief networks.
2014,scalable bayesian low-rank decomposition of incomplete multiway tensors.
2014,beta diffusion trees.
2014,learning character-level representations for part-of-speech tagging.
2014,saddle points and accelerated perceptron algorithms.
2014,robust distance metric learning via simultaneous l1-norm minimization and maximization.
2014,learning from contagion (without timestamps).
2014,stochastic variational inference for bayesian time series models.
2014,a clockwork rnn.
2014,estimating latent-variable graphical models using moments and likelihoods.
2014,universal matrix completion.
2014,finding dense subgraphs via low-rank bilinear optimization.
2014,compositional morphology for word representations and language modelling.
2014,learning polynomials with neural networks.
2014,exponential family matrix completion under structural constraints.
2014,sample-based approximate regularization.
2014,a compilation target for probabilistic programming languages.
2014,adaptive monte carlo via bandit allocation.
2014,efficient dimensionality reduction for high-dimensional network estimation.
2014,deterministic anytime inference for stochastic continuous-time markov processes.
2014,doubly stochastic variational bayes for non-conjugate inference.
2014,efficient learning of mahalanobis metrics for ranking.
2014,gev-canonical regression for accurate binary class probability estimation when one class is rare.
2014,a reversible infinite hmm using normalised random measures.
2014,"structured low-rank matrix factorization: optimality, algorithm, and applications to image processing."
2014,influence function learning in information diffusion networks.
2015,stochastic optimization with importance sampling for regularized loss minimization.
2015,approval voting and incentives in crowdsourcing.
2015,a low variance consistent test of relative dependency.
2015,an aligned subtree kernel for weighted graphs.
2015,spectral clustering via the power method - provably.
2015,information geometry and minimum description length networks.
2015,efficient training of lda on a gpu by mean-for-mode estimation.
2015,adaptive stochastic alternating direction method of multipliers.
2015,a lower bound for the optimization of finite sums.
2015,learning word representations with hierarchical sparse coding.
2015,learning transferable features with deep adaptation networks.
2015,robust partially observable markov decision process.
2015,on the relationship between sum-product networks and bayesian networks.
2015,learning from corrupted binary labels via class-probability estimation.
2015,an explicit sampling dependent spectral error bound for column subset selection.
2015,a stochastic pca and svd algorithm with an exponential convergence rate.
2015,attribute efficient linear regression with distribution-dependent sampling.
2015,learning local invariant mahalanobis distances.
2015,finding linear structure in large datasets with scalable canonical correlation analysis.
2015,abstraction selection in model-based reinforcement learning.
2015,surrogate functions for maximizing precision at the top.
2015,optimizing non-decomposable performance measures: a tale of two classes.
2015,coresets for nonparametric estimation - the case of dp-means.
2015,a relative exponential weighing algorithm for adversarial utility-based dueling bandits.
2015,functional subspace clustering with application to time series.
2015,accelerated online low rank tensor learning for multivariate spatiotemporal streams.
2015,atomic spatial processes.
2015,classification with low rank and missing data.
2015,dynamic sensing: better classification under acquisition constraints.
2015,a modified orthant-wise limited memory quasi-newton method with convergence analysis.
2015,telling cause from effect in deterministic linear dynamical systems.
2015,high dimensional bayesian optimisation and bandits via additive models.
2015,theory of dual-sparse regularized randomized reduction.
2015,generalization error bounds for learning to rank: does the length of document lists matter?
2015,peakseg: constrained optimal segmentation and supervised penalty learning for peak detection in count data.
2015,mind the duality gap: safer rules for the lasso.
2015,a general analysis of the convergence of admm.
2015,stochastic primal-dual coordinate method for regularized empirical risk minimization.
2015,disco: distributed optimization for self-concordant empirical loss.
2015,spectral mle: top-k rank aggregation from pairwise comparisons.
2015,paired-dual learning for fast training of latent variable hinge-loss mrfs.
2015,structural maxent models.
2015,a provable generalized tensor spectral method for uniform hypergraph partitioning.
2015,the benefits of learning with strongly convex approximate inference.
2015,pushing the limits of affine rank minimization by adapting probabilistic pca.
2015,budget allocation problem with multiple advertisers: a game theoretic view.
2015,tracking approximate solutions of parameterized optimization problems over multi-dimensional (hyper-)parameter domains.
2015,batch normalization: accelerating deep network training by reducing internal covariate shift.
2015,distributed estimation of generalized matrix rank: efficient algorithms and lower bounds.
2015,landmarking manifolds with gaussian processes.
2015,markov mixed membership models.
2015,a unified framework for outlier-robust pca-like algorithms.
2015,streaming sparse principal component analysis.
2015,a divide and conquer framework for distributed graph clustering.
2015,how can deep rectifier networks achieve linear separability and preserve distances?
2015,improved regret bounds for undiscounted continuous reinforcement learning.
2015,the fundamental incompatibility of scalable hamiltonian monte carlo and naive data subsampling.
2015,faster rates for the frank-wolfe method over strongly-convex sets.
2015,ordered stick-breaking prior for sequential mcmc inference of bayesian nonparametric models.
2015,online learning of eigenvectors.
2015,a unifying framework of anytime sparse gaussian process regression models with stochastic variational inference for big data.
2015,yinyang k-means: a drop-in replacement of the classic k-means with consistent speedup.
2015,ordinal mixed membership models.
2015,online tracking by learning discriminative saliency map with convolutional neural network.
2015,fast kronecker inference in gaussian processes with non-gaussian likelihoods.
2015,statistical and algorithmic perspectives on randomized sketching for ordinary least-squares.
2015,on td(0) with function approximation: concentration bounds and a centered variant with exponential convergence.
2015,learning parametric-output hmms with two aliased states.
2015,latent gaussian processes for distribution estimation of multivariate categorical data.
2015,improving the gaussian process sparse spectrum approximation by representing uncertainty in frequency inputs.
2015,ranking from stochastic pairwise preferences: recovering condorcet winners and tournament solution sets at the top.
2015,stochastic dual coordinate ascent with adaptive probabilities.
2015,vector-space markov random fields via exponential families.
2015,jump-means: small-variance asymptotics for markov jump processes.
2015,low rank approximation using error correcting coding matrices.
2015,off-policy model-based learning under unknown factored dynamics.
2015,log-euclidean metric learning on symmetric positive definite manifold with application to image set classification.
2015,asymmetric transfer learning with deep gaussian processes.
2015,towards a lower sample complexity for robust one-bit compressed sensing.
2015,bilbowa: fast bilingual distributed representations without word alignments.
2015,multi-view sparse co-clustering via proximal alternating linearized minimization.
2015,cascading bandits: learning to rank in the cascade model.
2015,latent topic networks: a versatile probabilistic programming framework for topic models.
2015,random coordinate descent methods for minimizing decomposable submodular functions.
2015,alpha-beta divergences discover micro and macro structures in data.
2015,fictitious self-play in extensive-form games.
2015,counterfactual risk minimization: learning from logged bandit feedback.
2015,the hedge algorithm on a continuum.
2015,a linear dynamical system model for text.
2015,unsupervised learning of video representations using lstms.
2015,message passing for collective graphical models.
2015,dp-space: bayesian nonparametric subspace clustering with small-variance asymptotics.
2015,hawkestopic: a joint model for network inference and topic modeling from text-based cascades.
2015,made: masked autoencoder for distribution estimation.
2015,an online learning algorithm for bilinear models.
2015,adaptive belief propagation.
2015,large-scale log-determinant computation through stochastic chebyshev expansions.
2015,differentially private bayesian optimization.
2015,a nearly-linear time framework for graph-structured sparsity.
2015,support matrix machines.
2015,"rademacher observations, private data, and boosting."
2015,from word embeddings to document distances.
2015,bayesian and empirical bayesian forests.
2015,inferring graphs from cascades: a sparse recovery framework.
2015,distributed box-constrained quadratic optimization for dual linear svm.
2015,safe exploration for optimization with gaussian processes.
2015,the ladder: a reliable leaderboard for machine learning competitions.
2015,enabling scalable stochastic gradient-based inference for gaussian processes by employing the unbiased linear system solver (ulisse).
2015,finding galaxies in the shadows of quasars with gaussian processes.
2015,following the perturbed leader for online structured learning.
2015,reified context models.
2015,large-scale markov decision problems with kl control cost and its application to crowdsourcing.
2015,learning fast-mixing models for structured prediction.
2015,a probabilistic model for dirty multi-task feature selection.
2015,on deep multi-view representation learning.
2015,learning program embeddings to propagate feedback on student code.
2015,safe subspace screening for nuclear norm regularized least squares problems.
2015,efficient learning in large-scale combinatorial semi-bandits.
2015,swept approximate message passing for sparse estimation.
2015,simple regret for infinitely many armed bandits.
2015,exponential integration for hamiltonian monte carlo.
2015,optimal regret analysis of thompson sampling in stochastic multi-armed bandit problem with multiple plays.
2015,faster cover trees.
2015,blitz: a principled meta-algorithm for scaling sparse optimization.
2015,unsupervised domain adaptation by backpropagation.
2015,non-linear cross-domain collaborative filtering via hyper-structure transfer.
2015,manifold-valued dirichlet processes.
2015,multi-task learning for subspace segmentation.
2015,markov chain monte carlo and variational inference: bridging the gap.
2015,scalable model selection for large-scale factorial relational models.
2015,the power of randomization: distributed submodular maximization on massive datasets.
2015,dealing with small data: on the generalization of context trees.
2015,non-gaussian discriminative factor models via the max-margin rank-likelihood.
2015,a bayesian nonparametric procedure for comparing algorithms.
2015,convergence rate of bayesian tensor estimator and its minimax optimality.
2015,on identifying good options under combinatorially structured feedback in finite noisy environments.
2015,nested sequential monte carlo methods.
2015,sparse variational inference for generalized gp models.
2015,universal value function approximators.
2015,approximate dynamic programming for two-player zero-sum markov games.
2015,on greedy maximization of entropy.
2015,metadata dependent mondrian processes.
2015,complex event detection using semantic saliency and nearly-isotonic svm.
2015,rebuilding factorized information criterion: asymptotically accurate marginal likelihood.
2015,double nyström method: an efficient and accurate nyström scheme for large-scale data sets.
2015,the composition theorem for differential privacy.
2015,convex formulation for learning from positive and unlabeled data.
2015,threshold influence model for allocating advertising budgets.
2015,strongly adaptive online learning.
2015,cur algorithm for partially observed matrices.
2015,a deterministic analysis of noisy sparse subspace clustering for dimensionality-reduced data.
2015,mra-based statistical learning from incomplete rankings.
2015,risk and regret of hierarchical bayesian learners.
2015,towards a learning theory of cause-effect inference.
2015,draw: a recurrent neural network for image generation.
2015,multiview triplet embedding: learning attributes in multiple maps.
2015,distributed gaussian processes.
2015,guaranteed tensor decomposition: a moment approach.
2015,"\(\ell_{1, p}\)-norm regularization: error bounds and convergence rate analysis of first-order methods."
2015,consistent estimation of dynamic and multi-layer block models.
2015,on the rate of convergence and error bounds for lstd(\(\lambda\)).
2015,variational inference with normalizing flows.
2015,controversy in mechanistic modelling with gaussian processes.
2015,convex learning of multiple tasks and their structure.
2015,k-hyperplane hinge-minimax classifier.
2015,non-stationary approximate modified policy iteration.
2015,entropy evaluation based on confidence intervals of frequency estimates : application to the learning of decision trees.
2015,geometric conditions for subspace-sparse recovery.
2015,an empirical study of stochastic variational inference algorithms for the beta bernoulli process.
2015,long short-term memory over recursive structures.
2015,weight uncertainty in neural network.
2015,learning submodular losses with the lovasz hinge.
2015,coordinate descent converges faster with the gauss-southwell rule than random selection.
2015,hashing for distributed data.
2015,large-scale distributed dependent nonparametric trees.
2015,qualitative multi-armed bandits: a quantile-based approach.
2015,deep edge-aware filters.
2015,a convex optimization framework for bi-clustering.
2015,is feature selection secure against training data poisoning?
2015,predictive entropy search for bayesian optimization with unknown constraints.
2015,a theoretical analysis of metric hypothesis transfer learning.
2015,generative moment matching networks.
2015,stay on path: pca along graph paths.
2015,deep learning with limited numerical precision.
2015,safe screening for multi-task feature learning with multiple data matrices.
2015,harmonic exponential families on manifolds.
2015,training deep convolutional neural networks to play go.
2015,kernel interpolation for scalable structured gaussian processes (kiss-gp).
2015,learning deep structured models.
2015,community detection using time-dependent personalized pagerank.
2015,scalable variational inference in log-supermodular models.
