Year,Title
2017,gradient projection iterative sketch for large-scale constrained least-squares.
2017,neural networks and rational functions.
2017,stochastic dca for the large-sum of non-convex functions problem and its application to group variable selection in classification.
2017,an analytical formula of population gradient for two-layered relu network and its applications in convergence and critical point analysis.
2017,evaluating the variance of likelihood-ratio gradient estimators.
2017,accelerating eulerian fluid simulation with convolutional networks.
2017,boosted fitted q-iteration.
2017,diameter-based active learning.
2017,magnetic hamiltonian monte carlo.
2017,know-evolve: deep temporal reasoning for dynamic knowledge graphs.
2017,hyperplane clustering via dual principal component pursuit.
2017,breaking locality accelerates block gauss-seidel.
2017,multilabel classification with group testing and codes.
2017,learning stable stochastic nonlinear dynamical systems.
2017,learning determinantal point processes with moments and cycles.
2017,automatic discovery of the statistical types of variables in a dataset.
2017,model-independent online learning for influence maximization.
2017,feudal networks for hierarchical reinforcement learning.
2017,scalable multi-class gaussian process classification using expectation propagation.
2017,learning to generate long-term future via hierarchical prediction.
2017,on orthogonality and learning recurrent networks with long term dependencies.
2017,fast bayesian intensity estimation for the permanental process.
2017,optimal and adaptive off-policy evaluation in contextual bandits.
2017,capacity releasing diffusion for speed and locality.
2017,"sketched ridge regression: optimization perspective, statistical perspective, and model averaging."
2017,robust gaussian graphical model estimation with arbitrary corruption.
2017,max-value entropy search for efficient bayesian optimization.
2017,efficient distributed learning with sparsity.
2017,robust probabilistic modeling with bayesian data reweighting.
2017,batched high-dimensional bayesian optimization via structural kernel learning.
2017,tensor decomposition via simultaneous power iteration.
2017,sequence modeling via segmentations.
2017,variational policy for guiding point processes.
2017,exploiting strong convexity from data with primal-dual first-order algorithms.
2017,beyond filters: compact feature map for portable deep model.
2017,a unified variance reduction-based framework for nonconvex low-rank matrix recovery.
2017,source-target similarity modelings for multi-source transfer gaussian process regression.
2017,latent intention dialogue models.
2017,unifying task specification in reinforcement learning.
2017,learned optimizers that scale and generalize.
2017,exact inference for integer latent-variable models.
2017,tensor belief propagation.
2017,a unified view of multi-label performance measures.
2017,dual supervised learning.
2017,learning latent space models with angular constraints.
2017,uncorrelation and evenness: a new diversity-promoting regularizer.
2017,stochastic convex optimization: faster local growth implies faster global convergence.
2017,learning hawkes processes from short doubly-censored event sequences.
2017,adaptive consensus admm for distributed optimization.
2017,high-dimensional non-gaussian single index models via thresholded score function estimation.
2017,towards k-means-friendly spaces: simultaneous deep learning and clustering.
2017,on the projection operator to a three-view cardinality constrained set.
2017,improved variational autoencoders for text modeling using dilated convolutions.
2017,tensor-train recurrent neural networks for video classification.
2017,a richer theory of convex constrained optimization with reduced projections and improved rates.
2017,sparse + group-sparse dirty models: statistical guarantees without unreasonable conditions and a case for non-convexity.
2017,scalable bayesian rule lists.
2017,approximate newton methods and their local convergence.
2017,a simulated annealing based inexact oracle for wasserstein loss minimization.
2017,latent feature lasso.
2017,combined group and exclusive sparsity for deep neural networks.
2017,latent lstm allocation: joint clustering and non-linear dynamic modeling of sequence data.
2017,canopy fast sampling with cover trees.
2017,continual learning through synaptic intelligence.
2017,stochastic gradient monomial gamma sampler.
2017,adversarial feature matching for text generation.
2017,scaling up sparse support vector machines by simultaneous feature and sample reduction.
2017,re-revisiting learning on hypergraphs: confidence interval and subgradient method.
2017,"zipml: training linear models with end-to-end low precision, and a little bit of deep learning."
2017,convexified convolutional neural networks.
2017,projection-free distributed online learning in networks.
2017,multi-class optimal margin distribution machine.
2017,leveraging node attributes for incomplete relational data.
2017,theoretical properties for neural networks with weight matrices of low displacement rank.
2017,learning hierarchical features from deep generative models.
2017,learning sleep stages from radio signals: a conditional adversarial architecture.
2017,follow the moving leader in deep learning.
2017,asynchronous stochastic gradient descent with delay compensation.
2017,"collect at once, use effectively: making non-interactive locally private learning possible."
2017,recovery guarantees for one-hidden-layer neural networks.
2017,stochastic adaptive quasi-newton methods for minimizing expected values.
2017,identify the nash equilibrium in static games with random payoffs.
2017,"when can multi-site datasets be pooled for regression? hypothesis tests, $\ell_2$-consistency and neuroscience applications."
2017,high-dimensional variance-reduced stochastic gradient expectation-maximization algorithm.
2017,recurrent highway networks.
2017,online learning to rank in stochastic click models.
2018,improved regret bounds for thompson sampling in linear quadratic control problems.
2018,state abstractions for lifelong reinforcement learning.
2018,policy and value transfer in lifelong reinforcement learning.
2018,inspectre: privately estimating the unseen.
2018,learning representations and generative models for 3d point clouds.
2018,discovering interpretable representations for both deep generative and discriminative models.
2018,a reductions approach to fair classification.
2018,accelerated spectral ranking.
2018,mission: ultra large-scale feature selection using count-sketches.
2018,minimal i-map mcmc for scalable structure discovery in causal dag models.
2018,"proportional allocation: simple, distributed, and diverse matching with high entropy."
2018,bucket renormalization for approximate inference.
2018,oi-vae: output interpretable vaes for nonlinear group factor analysis.
2018,limits of estimating heterogeneous treatment effects: guidelines for practical algorithm design.
2018,autoprognosis: automated clinical prognostic modeling via bayesian optimization with structured kernel learning.
2018,information theoretic guarantees for empirical risk minimization with applications to model selection and large-scale optimization.
2018,fixing a broken elbo.
2018,differentially private identity and equivalence testing of discrete distributions.
2018,katyusha x: practical momentum method for stochastic sum-of-nonconvex optimization.
2018,make the minority great again: first-order regret bound for contextual bandits.
2018,augmented cyclegan: learning many-to-many mappings from unpaired data.
2018,meta-learning by adjusting priors based on extended pac-bayes theory.
2018,magan: aligning biological manifolds.
2018,subspace embedding and linear regression with orlicz norm.
2018,efficient gradient-free variational inference using policy search.
2018,on the optimization of deep networks: implicit acceleration by overparameterization.
2018,stronger generalization bounds for deep nets via a compression approach.
2018,lipschitz continuity in model-based reinforcement learning.
2018,obfuscated gradients give a false sense of security: circumventing defenses to adversarial examples.
2018,synthesizing robust adversarial examples.
2018,clustering semi-random mixtures of gaussians.
2018,contextual graph markov model: a deep and generative approach to graph processing.
2018,greed is still good: maximizing monotone submodular+supermodular (bp) functions.
2018,comparing dynamics: deep neural networks versus glassy systems.
2018,smac: simultaneous mapping and clustering using spectral decompositions.
2018,a boo(n) for evaluating architecture performance.
2018,learning to branch.
2018,the mechanics of n-player differentiable games.
2018,spline filters for end-to-end deep learning.
2018,a spline theory of deep networks.
2018,approximation guarantees for adaptive sampling.
2018,improving the gaussian mechanism for differential privacy: analytical calibration and optimal denoising.
2018,"dissecting adam: the sign, magnitude and variance of stochastic gradients."
2018,differentially private database release via kernel mean embeddings.
2018,improving optimization in models with continuous symmetry breaking.
2018,improved training of generative adversarial networks using representative features.
2018,using inherent structures to design lean 2-layer rbms.
2018,classification from pairwise similarity and unlabeled data.
2018,bayesian optimization of combinatorial structures.
2018,geodesic convolutional shape optimization.
2018,learning to coordinate with coordination graphs in repeated single-stage multi-agent decision problems.
2018,testing sparsity over known and unknown bases.
2018,transfer in deep reinforcement learning using successor features and generalised policy improvement.
2018,gradient descent with identity initialization efficiently learns positive definite linear transformations.
2018,mutual information neural estimation.
2018,to understand deep learning we need to understand kernel learning.
2018,understanding and simplifying one-shot architecture search.
2018,signsgd: compressed optimisation for non-convex problems.
2018,distributed clustering via lsh based data partitioning.
2018,autoregressive convolutional neural networks for asynchronous time series.
2018,adaptive sampled softmax with kernel based sampling.
2018,optimizing the latent space of generative networks.
2018,netgan: generating graphs via random walks.
2018,a progressive batching l-bfgs method for machine learning.
2018,prediction rule reshaping.
2018,quanttree: histograms for change detection in multivariate data streams.
2018,"matrix norms in data streams: faster, multi-pass and row-order."
2018,predict and constrain: modeling cardinality in deep structured prediction.
2018,quasi-monte carlo variational inference.
2018,path-level network transformation for efficient architecture search.
2018,improved large-scale graph learning through ridge spectral sparsification.
2018,bayesian coreset construction via greedy iterative geodesic ascent.
2018,adversarial learning with local coordinate coding.
2018,fair and diverse dpp-based data summarization.
2018,conditional noise-contrastive estimation of unnormalised models.
2018,adversarial time-to-event modeling.
2018,stability and generalization of learning algorithms that converge to global optima.
2018,learning and memorization.
2018,on the theory of variance reduction for stochastic gradient monte carlo.
2018,hierarchical clustering with structural constraints.
2018,hierarchical deep generative models for multi-rate multivariate time series.
2018,gradnorm: gradient normalization for adaptive loss balancing in deep multitask networks.
2018,weakly submodular maximization beyond cardinality constraints: does randomization help greedy?
2018,projection-free online optimization with stochastic gradient: from convexity to submodularity.
2018,continuous-time flows for efficient inference and density estimation.
2018,scalable bilinear learning using state and action features.
2018,stein points.
2018,learning k-way d-dimensional discrete codes for compact embedding representations.
2018,pixelsnail: an improved autoregressive generative model.
2018,dynamical isometry and a mean field theory of rnns: gating enables signal propagation in recurrent neural networks.
2018,learning to explain: an information-theoretic perspective on model interpretation.
2018,variational inference and model selection with generalized evidence bounds.
2018,draco: byzantine-resilient distributed training via redundant gradients.
2018,sadagrad: strongly adaptive stochastic gradient methods.
2018,covariate adjusted precision matrix estimation via nonconvex optimization.
2018,end-to-end learning for the deep multivariate probit model.
2018,stochastic training of graph convolutional networks with variance reduction.
2018,extreme learning to rank via low rank assumption.
2018,learning a mixture of two multinomial logits.
2018,structured evolution with compact architectures for scalable policy optimization.
2018,path consistency learning in tsallis entropy regularized mdps.
2018,"an iterative, sketching-based framework for ridge regression."
2018,stochastic wasserstein barycenters.
2018,self-consistent trajectory autoencoder: hierarchical reinforcement learning with trajectory embeddings.
2018,on acceleration with noise-corrupted gradients.
2018,online linear quadratic control.
2018,gep-pg: decoupling exploration and exploitation in deep reinforcement learning algorithms.
2018,leveraging well-conditioned bases: streaming and distributed summaries in minkowski p-norms.
2018,efficient modelbased deep reinforcement learning with variational state tabulation.
2018,online learning with abstention.
2018,constrained interacting submodular groupings.
2018,inference suboptimality in variational autoencoders.
2018,mix & match agent curricula for reinforcement learning.
2018,implicit quantile networks for distributional reinforcement learning.
2018,learning steady-states of iterative algorithms over graphs.
2018,adversarial attack on graph structured data.
2018,sbeed: convergent reinforcement learning with nonlinear function approximation.
2018,compressing neural networks using the variational information bottleneck.
2018,asynchronous byzantine machine learning (the case of sgd).
2018,escaping saddles with stochastic gradients.
2018,minibatch gibbs sampling on large graphical models.
2018,stochastic video generation with a learned prior.
2018,decomposition of uncertainty in bayesian deep learning for efficient and risk-sensitive learning.
2018,accurate inference for adaptive linear models.
2018,variational network inference: strong and stable with concrete support.
2018,modeling sparse deviations for compressed sensing using generative models.
2018,alternating randomized block coordinate descent.
2018,learning to act in decentralized partially observable mdps.
2018,noisin: unbiased regularization for recurrent neural networks.
2018,discovering and removing exogenous state variables and rewards for reinforcement learning.
2018,coordinated exploration in concurrent reinforcement learning.
2018,probabilistic recurrent state-space models.
2018,randomized block cubic newton method.
2018,low-rank riemannian optimization on positive semidefinite stochastic matrices with applications to graph clustering.
2018,essentially no barriers in neural network energy landscape.
2018,weakly consistent optimal pricing algorithms in repeated posted-price auctions with strategic buyer.
2018,on the power of over-parametrization in neural networks with quadratic activation.
2018,gradient descent learns one-hidden-layer cnn: don't be afraid of spurious local minima.
2018,investigating human priors for playing video games.
2018,a distributed second-order algorithm you can trust.
2018,computational optimal transport: complexity by accelerated gradient descent is better than by sinkhorn's algorithm.
2018,entropy-sgd optimizes the prior of a pac-bayes bound: generalization properties of entropy-sgd and data-dependent priors.
2018,beyond the one-step greedy approach in reinforcement learning.
2018,parallel and streaming algorithms for k-core decomposition.
2018,impala: scalable distributed deep-rl with importance weighted actor-learner architectures.
2018,scalable gaussian processes with grid-structured eigenfunctions (gp-grief).
2018,"the limits of maxing, ranking, and preference learning."
2018,bohb: robust and efficient hyperparameter optimization at scale.
2018,more robust doubly robust off-policy evaluation.
2018,efficient and consistent adversarial bipartite matching.
2018,global convergence of policy gradient methods for the linear quadratic regulator.
2018,crvi: convex relaxation for variational inference.
2018,fourier policy gradients.
2018,nonparametric variable importance using an augmented neural network with multi-task learning.
2018,closed-form marginal likelihood in gamma-poisson matrix factorization.
2018,automatic goal generation for reinforcement learning agents.
2018,dice: the infinitely differentiable monte carlo estimator.
2018,practical contextual bandits with regression oracles.
2018,generative temporal models with spatial memory for partially observed environments.
2018,admm and accelerated admm as continuous dynamical systems.
2018,bilevel programming for hyperparameter optimization and meta-learning.
2018,efficient bias-span-constrained exploration-exploitation in reinforcement learning.
2018,addressing function approximation error in actor-critic methods.
2018,clipped action policy gradient.
2018,born-again neural networks.
2018,local private hypothesis testing: chi-square tests.
2018,inductive two-layer modeling with parametric bregman transfer.
2018,hyperbolic entailment cones for learning hierarchical embeddings.
2018,parameterized algorithms for the matrix completion problem.
2018,synthesizing programs for images using reinforced adversarial learning.
2018,spotlight: optimizing device placement for training deep neural networks.
2018,parallel bayesian network structure learning.
2018,structured output learning with abstention: application to accurate opinion prediction.
2018,conditional neural processes.
2018,temporal poisson square root graphical models.
2018,the generalization error of dictionary learning with moreau envelopes.
2018,budgeted experiment design for causal structure learning.
2018,linear spectral estimators and an application to phase retrieval.
2018,structured variational learning of bayesian neural networks with horseshoe priors.
2018,learning maximum-a-posteriori perturbation models for structured prediction in polynomial time.
2018,robust and scalable models of microbiome dynamics.
2018,non-linear motor control by local learning in spiking neural networks.
2018,learning one convolutional layer with overlapping patches.
2018,visualizing and understanding atari agents.
2018,learning policy representations in multiagent systems.
2018,faster derivative-free stochastic algorithm for shared memory machines.
2018,learning to search with mctsnets.
2018,characterizing implicit bias in terms of optimization geometry.
2018,shampoo: preconditioned stochastic tensor optimization.
2018,latent space policies for hierarchical reinforcement learning.
2018,soft actor-critic: off-policy maximum entropy deep reinforcement learning with a stochastic actor.
2018,comparison-based random forests.
2018,k-beam minimax: efficient optimization for deep adversarial learning.
2018,candidates vs. noises estimation for large multi-class classification problem.
2018,stein variational gradient descent without gradient.
2018,rectify heterogeneous models with semantic mapping.
2018,deep models of interactions across sets.
2018,learning memory access patterns.
2018,fairness without demographics in repeated loss minimization.
2018,multicalibration: calibration for the (computationally-identifiable) masses.
2018,recurrent predictive state policy networks.
2018,learning unknown ode models with gaussian processes.
2018,orthogonal recurrent neural networks with scaled cayley transform.
2018,fast bellman updates for robust mdps.
2018,cycada: cycle-consistent adversarial domain adaptation.
2018,sound abstraction and decomposition of probabilistic programs.
2018,gradient primal-dual algorithm converges to second-order stationary solution for nonconvex distributed optimization over networks.
2018,variational bayesian dropout: pitfalls and fixes.
2018,does distributionally robust supervised learning give robust classifiers?
2018,dissipativity theory for accelerating stochastic variance reduction: a unified analysis of svrg and katyusha using semidefinite programs.
2018,near optimal frequent directions for sketching dense and sparse matrices.
2018,learning deep resnet blocks sequentially using boosting theory.
2018,learning hidden markov models from pairwise co-occurrences with application to topic modeling.
2018,neural autoregressive flows.
2018,topological mixture estimation.
2018,decoupled parallel backpropagation with convergence guarantee.
2018,using reward machines for high-level task specification and decomposition in reinforcement learning.
2018,deep variational reinforcement learning for pomdps.
2018,attention-based deep multiple instance learning.
2018,black-box adversarial attacks with limited queries and information.
2018,analysis of minimax error rate for crowdsourcing and its application to worker clustering model.
2018,improving regression performance with distributional losses.
2018,deep density destructors.
2018,unbiased objective estimation in predictive optimization.
2018,anonymous walk embeddings.
2018,learning binary latent variable models: a tensor eigenpair approach.
2018,firing bandits: optimizing crowdfunding.
2018,differentially private matrix completion revisited.
2018,video prediction with appearance and motion conditions.
2018,pathwise derivatives beyond the reparameterization trick.
2018,detecting non-causal artifacts in multivariate linear regression models.
2018,a unified framework for structured low-rank matrix learning.
2018,efficient end-to-end learning for quantizable representations.
2018,exploring hidden dimensions in parallelizing convolutional neural networks.
2018,feedback-based tree search for reinforcement learning.
2018,quickshift++: provably good initializations for sample-based mean shift.
2018,mentornet: learning data-driven curriculum for very deep neural networks on corrupted labels.
2018,the weighted kendall and high-order kernels for permutations.
2018,junction tree variational autoencoder for molecular graph generation.
2018,network global testing by counting graphlets.
2018,regret minimization for partially observable deep reinforcement learning.
2018,wsnet: compact and efficient networks through weight sampling.
2018,large-scale cox process inference using variational fourier features.
2018,composite functional gradient learning of generative adversarial models.
2018,kronecker recurrent units.
2018,fast decoding in sequence models using discrete latent variables.
2018,kernel recursive abc: point estimation with intractable likelihood.
2018,efficient neural audio synthesis.
2018,learning diffusion using hyperparameters.
2018,signal and noise statistics oblivious orthogonal matching pursuit.
2018,residual unfairness in fair machine learning from prejudiced data.
2018,learn from your neighbor: learning multi-modal mappings from sparse annotations.
2018,semi-supervised learning via compact latent space clustering.
2018,policy optimization with demonstrations.
2018,improving sign random projections with additional information.
2018,let's be honest: an optimal no-regret framework for zero-sum games.
2018,continual reinforcement learning with complex synapses.
2018,lavan: localized and visible adversarial noise.
2018,riemannian stochastic recursive gradient algorithm with retraction and vector transport and its convergence analysis.
2018,not all samples are created equal: deep learning with importance sampling.
2018,feasible arm identification.
2018,scalable deletion-robust submodular maximization: data summarization with privacy and fairness constraints.
2018,focused hierarchical rnns for conditional sequence processing.
2018,preventing fairness gerrymandering: auditing and learning for subgroup fairness.
2018,improved nearest neighbor search using auxiliary information and priority functions.
2018,contextnet: deep learning for star galaxy classification.
2018,frank-wolfe with subsampling oracle.
2018,convergence guarantees for a class of non-convex and non-smooth optimization problems.
2018,fast and scalable bayesian deep learning by weight-perturbation in adam.
2018,geometry score: a method for comparing generative adversarial networks.
2018,blind justice: fairness with encrypted sensitive attributes.
2018,markov modulated gaussian cox processes for semi-stationary intensity modeling of events data.
2018,disentangling by factorising.
2018,self-bounded prediction suffix tree via approximate string matching.
2018,interpretability beyond feature attribution: quantitative testing with concept activation vectors (tcav).
2018,semi-amortized variational autoencoders.
2018,neural relational inference for interacting systems.
2018,an alternative view: when does sgd escape local minima?
2018,crowdsourcing with arbitrary adversaries.
2018,spatio-temporal bayesian on-line changepoint detection with model selection.
