Year,Title
1988,using a generalization hierarchy to learn from examples.
1988,tuning rule-based systems to their environments.
1988,on asking the right questions.
1988,concept simplification and prediction accuracy.
1988,learning graph models of shape.
1988,learning categorical decision criteria in biomedical domains.
1988,conceptual clumping of binary vectors with occam's razor.
1988,autoclass: a bayesian classification system.
1988,incremental multiple concept learning using experiments.
1988,trading off simplicity and coverage in incremental concept learning.
1988,deferred commitment in unimem: waiting to learn.
1988,experiments on the costs and benefits of windowing in id3.
1988,improved decision trees: a generalized version of id3.
1988,id5: an incremental id3.
1988,using weighted networks to represent classification knowledge in noisy domains.
1988,an empirical comparison of genetic and decision-tree classifiers.
1988,population size in classifier systems.
1988,representation and hidden bias: gray vs. binary coding for genetic algorithms.
1988,classifier systems with hamming weights.
1988,midgard: a genetic approach to adaptive load balancing for distributed systems.
1988,some interesting properties of a connectionist inductive learning system.
1988,competitive reinforcement learning.
1988,connectionist learning of expert backgammon evaluations.
1988,building and using mental models in a sensory-motor domain.
1988,reasoning about operationality for explanation-based learning.
1988,boundaries of operationality.
1988,on the tractability of learning from incomplete theories.
1988,active explanation reduction: an approach to the multiple explanations problem.
1988,generalizing number and learning from multiple examples in explanation based learning.
1988,generalizing the order of operators in macro-operators.
1988,using experience-based learning in game playing.
1988,integrated learning with incorrect and incomplete theories.
1988,an approach based on integrated learning to generating stories.
1988,a knowledge intensive approach to concept induction.
1988,learning to program by examining and modifying cases.
1988,theory discovery and the hypothesis language.
1988,machine invention of first order predicates by inverting resolution.
1988,"the interdependencies of theory formation, revision, and experimentation."
1988,a hill-climbing approach to machine discovery.
1988,reduction: a practical mechanism of searching for regularity in data.
1988,extending the valiant learning model.
1988,learning systems of first-order rules.
1988,two new frameworks for learning.
1988,hypothesis filtering: a practical approach to reliable learning.
1988,diffy-s: learning robot operator schemata from examples.
1988,experimental results from an evaluation of algorithms that learn to control dynamic systems.
1988,utilizing experience for improving the tactical manager.
1988,some chunks are expensive.
1988,the role of forgetting in learning.
1989,unifying themes in empirical and explanation-based learning.
1989,induction over the unexplained: integrated learning of concepts with both explainable and conventional aspects.
1989,conceptual clustering of explanations.
1989,a tight integration of deductive learning.
1989,multi-strategy learning in nonhomongeneous domain theories.
1989,a description of preference criterion in constructive learning: a discussion of basis issues.
1989,"combining case-based reasoning, explanation-based learning, and learning form instruction."
1989,deduction in top-down inductive learning.
1989,one-sided algorithms for integrating empirical and explanation-based learning.
1989,combining empirical and analytical learning with version spaces.
1989,finding new rules for incomplete theories: explicit biases for induction with contextual information.
1989,learning from plausible explanations.
1989,augmenting domain theory for explanation-based generalization.
1989,explanation based learning as constrained search.
1989,reducing search and learning goal preferences.
1989,adaptation-based explanation: explanations as cases.
1989,a retrieval model using feature selection.
1989,improving decision-making on the basis of experience.
1989,explanation-based acceleration of similarity-based learning.
1989,knowledge acquisition planning: results and prospects.
1989,"""learning by instruction"" in connectionist systems."
1989,integrating learning in a neural network.
1989,explanation-based learning with week domain theories.
1989,using domain knowledge to improve inductive learning algorithms for diagnosis.
1989,a framework for improving efficiency and accuracy.
1989,error correction in constructive induction.
1989,improving explanation-based indexing with empirical learning.
1989,a schema for an integrated learning system.
1989,combining explanation-based learning and artificial neural networks.
1989,learning classification rules using bayes.
1989,new empirical learning mechanisms perform significantly better in real life domains.
1989,inductive learning with bct.
1989,what good are experiments?.
1989,an experimental comparison of human and machine learning formalisms.
1989,two algorithms that learn dnf by discovering relevant features.
1989,limitations on inductive learning.
1989,the induction of probabilistic rule sets - the itrule algorithm.
1989,empirical substructure discovery.
1989,learning the behavior of dynamical systems form examples.
1989,experiments in robot learning.
1989,induction of decision trees from inconclusive data.
1989,knowledge intensive induction.
1989,an ounce of knowledge is worth a ton of data: quantitative studies of the trade-off between expertise and data based on statistically well-founded empirical induction.
1989,signal detection theory: valuable tools for evaluating inductive learning.
1989,unknown attribute values in induction.
1989,processing issues in comparisons of symbolic and connectionist learning systems.
1989,"bacon, data analysis and artificial intelligence."
1989,learning to plan in complex domains.
1989,an empirical analysis of ebl approaches for learning plan schemata.
1989,learning decision rules for scheduling problems: a classifier hybrid approach.
1989,learning tactical plans for pilot aiding.
1989,issues in the justification-based diagnosis of planning failures.
1989,learning procedural knowledge in the ebg context.
1989,learning invariants from explanations.
1989,using learning to recover side-effects of operators in robotics.
1989,learning to recognize plans involving affect.
1989,learning to retrieve useful information for problem solving.
1989,discovering problem solving strategies: what humans do and machines don't (yet).
1989,approximating learned search control knowledge.
1989,planning approximate plans for use in the real world.
1989,using concept hierarchies to organize plan knowledge.
1989,conceptual clustering of mean-ends plans.
1989,learning appropriate abstractions for planning in formation problems.
1989,discovering admissible search heuristics by abstracting and optimizing.
1989,learning hierarchies of abstraction spaces.
1989,learning from opportunity.
1989,learning by analyzing fortuitous occurrences.
1989,explanation-based learning of reactive operations.
1989,on becoming reactive.
1989,knowledge base refinement and theory revision.
1989,theory formation by abduction: initial results of a case study based on the chemical revolution.
1989,using domain knowledge to aid scientific theory revision.
1989,the role of experimentation in scientific theory revision.
1989,exemplar-based theory rejection: an approach to the experience consistency problem.
1989,controlling search for the consequences of new information during knowledge integration.
1989,identifying knowledge base deficiencies by observing user behavior.
1989,toward automated rational reconstruction: a case study.
1989,discovering mathematical operation definitions.
1989,imprecise concept learning within a growing language.
1989,using determinations in ebl: a solution to the incomplete theory problem.
1989,some results on the complexity of knowledge-based refinement.
1989,"knowledge base refinement as improving an incorrect, inconsistent and incomplete domain theory."
1989,incremental learning of control strategies with genetic algorithms.
1989,tower of hanoi with connectionist networks: learning new features.
1989,a formal framework for learning in embedded systems.
1989,a role for anticipation in reactive systems that learn.
1989,uncertainty based selection of learning experiences.
1989,improved training via incremental learning.
1989,incremental batch learning.
1989,incremental concept formation with composite objects.
1989,using multiple representations to improve inductive bias: gray and binary coding for genetic algorithms.
1989,focused concept formation.
1989,an exploration into incremental learning: the influence system.
1989,"incremental, instance-based learning of independent and graded concept descriptions."
1989,cost-sensitive concept learning of sensor use in approach ad recognition.
1989,reducing redundant learning.
1989,incremental clustering by minimizing representation length.
1989,information filters and their implementation in the syllog system.
1989,adaptive learning of decision-theoretic search control knowledge.
1989,atoms of learning ii: adaptive strategies a study of two-person zero-sum competition.
1989,an incremental genetic algorithm for real-time learning.
1989,participatory learning: a constructivist model.
1989,representational issues in machine learning.
1989,labor saving new distinctions.
1989,a theory of justified reformulations.
1989,reformation from state space to reduction space.
1989,knowledge-based feature generation.
1989,enriching vocabularies by generalizing explanation structures.
1989,higher-order and modal logic as a framework for explanation-based generalization.
1989,towards a formal analysis of ebl.
1989,a mathematical framework for studying representation.
1989,refining representations to improve problem solving quality.
1989,comparing systems and analyzing functions to improve constructive induction.
1989,evaluating alternative instance representations.
1989,evaluating bias during pac-learning.
1989,constructive induction framework.
1989,constructive induction by analogy.
1989,concept discovery through utilization of invariance embedded in the description language.
1989,declarative bias for structural domains.
1989,automatic construction of a hierarchical generate-and-test algorithm.
1989,a knowledge-level analysis of informing.
1989,an object-oriented representation for search algorithms.
1989,compiling learning vocabulary from a performance system description.
1989,generalized recursive splitting algorithms for learning hybrid concepts.
1989,screening hypotheses with explicit bias.
1989,building a learning bias from perceived dependencies.
1989,a bootstrapping approach to concept clustering.
1989,overcoming feature space bias in a reactive environment.
1990,knowledge acquisition from examples using maximal representation learning.
1990,kbg : a knowledge based generalizer.
1990,performance analysis of a probabilistic inductive learning system.
1990,a comparative study of id3 and backpropagation for english text-to-speech mapping.
1990,learning from data with bounded inconsistency.
1990,conceptual set covering: improving fit-and-split algorithms.
1990,incremental learning of rules and meta-rules.
1990,an incremental method for finding multivariate splits for decision trees.
1990,incremental induction of topologically minimal trees.
1990,a rational analysis of categorization.
1990,"search control, utility, and concept induction."
1990,graph clustering and model learning by data compression.
1990,an analysis of representation shift in concept learning.
1990,learning procedures by environment-driven constructive induction.
1990,beyond inversion of resolution.
1990,genetic programming.
1990,improving the performance of genetic algorithms in automated discovery of parameters.
1990,using genetic algorithms to learn disjunctive rules from examples.
1990,newboole: a fast gbml system.
1990,learning functions in k-dnf from reinforcement.
1990,is learning rate a good performance criterion for learning?
1990,active perception and reinforcement learning.
1990,learning plans for competitive domains.
1990,explanations of empirically derived reactive plans.
1990,learning and enforcement: stabilizing environments to facilitate activity.
1990,simulation-assisted learning by competition: effects of noise differences between training model and target environment.
1990,"integrated architectures for learning, planning, and reacting based on approximating dynamic programming."
1990,reducing real-world failures of approximate explanation-based rules.
1990,correcting and extending domain knowledge using outside guidance.
1990,acquisition of dynamic control knowledge for a robotic manipulator.
1990,feature extraction and clustering of tactile impressions with connectionist models.
1990,generalizing the order of goals as an approach to generalizing number.
1990,learning approximate control rules of high utility.
1990,applying abstraction and simplification to learn in intractable domains.
1990,explanation-based learning with incomplete theories: a three-step approach.
1990,using abductive recovery of failed proofs for problem solving by analogy.
1990,issues in the design of operator composition systems.
1990,incremental learning of explanation patterns and their indices.
1990,integrated learning in a real domain.
1990,incremental version-space merging.
1990,average case analysis of conjunctive learning algorithms.
1990,a framework for multi-paradigmatic learning.
1990,an integrated framework of inducing rules from examples.
1990,a general method for learning idiosyncratic grammars.
1990,a comparison of learning techniques in second language learning.
1990,learning string patterns and tree patterns from examples.
1990,learning with discrete multi-valued neurons.
1990,the general utility problem in machine learning.
1990,a robust approach to numeric discovery.
1990,more results on the complexity of knowledge base refinement: belief networks.
1991,design rationale capture as knowledge acquisition.
1991,a domain-independent framework for effective experimentation in planning.
1991,"knowledge refinement using a high level, non-technical vocabulary."
1991,improving the performance of inconsistent knowledge bases via combined optimization method.
1991,the flexibility of speculative refinement.
1991,generating error candidates for assigning blame in a knowledge base.
1991,a prototype based symbolic concept learning system.
1991,combining evidence of deep and surface similarity.
1991,the importance of causal structure and facts in evaluating explanations.
1991,ml
1991,modeling the acquisition and improvement of motor skkills.
1991,a computational model of acquisition for children's addtion strategies.
1991,internal world models and supervised learning.
1991,babel: a psychologically plausible cross-linguistic model of lexical and syntactic acquisition.
1991,the acquisition of human planning expertise.
1991,adaptive pattern-oriented chess.
1991,variability bias and category learning.
1991,a constraint-motivated model of lexical acquisition.
1991,computer modelling of acquisition orders in child language.
1991,simulating stages of human cognitive development with connectionist models.
1991,learning physics via explanation-based learning of correctness and analogical search control.
1991,incremental constructive induction: an instance-based approach.
1991,a transformational approach to constructive induction.
1991,learning variable descriptors for applying heuristics across csp problems.
1991,informed pruning in constructive induction.
1991,a hybrid method for feature generation.
1991,abstracting concepts with inverse resolution.
1991,opportunistic constructive induction.
1991,"quantifying the value of constructive induction, knowledge, and noise filtering on inductive learning."
1991,discovering production rules with higher order neural networks.
1991,constructive induction on symbolic features.
1991,comparison of methods based on inverse resolution.
1991,the need for constructive induction.
1991,constructive induction in theory refinement.
1991,constructive induction of m-of-n terms.
1991,"relations, knowledge and empirical learning."
1991,learning concepts by synthesizing minimal threshold gate networks.
1991,on the effect of instance representation on generalization.
1991,relational clichés: constraining induction during relational learning.
1991,learning polynomial functions by feature construction.
1991,constructive induction in knowledge-based neural networks.
1991,feature construction in structural decision trees.
1991,fringe-like feature construction: a comparative study and a unifying scheme.
1991,a neural network approach to constructive induction.
1991,learning in intelligent information retrieval.
1991,a probabilistic retrieval scheme for cluster-based adaptive information retrieval.
1991,classification trees for information retrieval.
1991,query formulation through knowledge acquisition.
1991,incremental learning in a probalistic information retrieval system.
1991,query learning using an ann with adaptive architecture.
1991,a goal-based approach to intelligent information retrieval.
1991,machine learning in the combination of expert opinion approach to ir.
1991,predicting actions from induction on past performance.
1991,decision-theoretic learning in an action system.
1991,on becoming decreasingly reactive: learning to deliberate minimally.
1991,learning the persistence of actions in reactive control rules.
1991,learning to avoid obstacles through reinforcement.
1991,learning football evaluation for a walking robot.
1991,the blind leading the blind: mutual refinement of approximate theories.
1991,learning to select a model in a changing world.
1991,learning from deliberated reactivity.
1991,"self-improvement based on reinforcement learning, planning and teaching."
1991,scaling reinforcement learning to robotics by exploiting the subsumption architecture.
1991,variable resolution dynamic programming.
1991,learning a set of primitive actions with an uninterpreted sensorimotor apparatus.
1991,incremental development of complex behaviors.
1991,transfer of learning across compositions of sequentail tasks.
1991,planning by incremental dynamic programming.
1991,learning a cost-sensitive internal representation for reinforcement learning.
1991,complexity and cooperation in q-learning.
1991,scaling reinforcement learning techniques via modularity.
1991,probabilistic concept formation in relational domains.
1991,experiments in non-monotonic learning.
1991,learning qualitative models of dynamic systems.
1991,an investigation of noise-tolerant relational concept learning algorithms.
1991,integrity constraints and interactive concept-learning.
1991,learning relations from noisy examples: an empirical comparison of linus and foil.
1991,inducing temporal fault diagnostic rules from a qualitative model.
1991,learning spatial relations from images.
1991,using inverse resolution to learn relations from experiments.
1991,"efficient learning of logic programs with non-determinant, non-discriminating literals."
1991,learning search control rules for planning: an inductive approach.
1991,learning constrained atoms.
1991,a knowledge-intensive approach to learning relational concepts.
1991,the consistent concept axiom.
1991,determinate literals in inductive logic programming.
1991,first-order theory revision.
1991,completeness for inductive procedures.
1991,constraints on predicate invention.
1991,revising relational domain theories.
1991,learning stochastic motifs from genetic sequences.
1991,refinement of approximate reasoning-based controllers by reinforcement learning.
1991,improving learning using causality and abduction.
1991,the ductor: a theory revision system for propositional domains.
1991,the generality of overgenerality.
1991,probabilistic evaluating of bias for learning systems.
1991,incremental refinement of approximate domain theories.
1991,an enhancer for reactive plans.
1991,a hybrid approach to guaranteed effective control strategies.
1991,revision cost for theory refinement.
1991,revision of reduced theories.
1991,refining domain theories expressed as finite-state automata.
1991,a smallest generalization step strategy.
1991,improving shared rules in multiple category domain theories.
1991,discovering regularities from large knowledge bases.
1991,learning with incrutable theories.
1991,a method for multistrategy task-adaptive learning based on plausible justifications.
1991,using background knowledge in concept formation.
1991,a study of how domain knowledge improves knowledge-based learning systems.
1991,is it a pocket or a purse? tighly coupled theory and data driven learing.
1991,identifying cost effective boundaries of operationality.
1991,machine learning in engineering automation.
1991,ml
1991,comparing stochastic planning to the acquisition of increasingly permissive plans.
1991,conceptual clustering and exploratory data analysis.
1991,megainduction: a test flight.
1991,knowledge compilation to speed up numerical optimization.
1991,model revision: a theory of incremental model learning.
1991,learning analytical knowledge about vlsi-design from observation.
1991,continous conceptual set covering: learning robot operators from examples.
1991,machine learning for nondestructive evaluation.
1991,improving recognition effectiveness of noisy texture concepts.
1991,knowledge-based equation discovery in engineering domains.
1991,design integrated learning systems for engineering design.
1991,database consistency via inductive learning.
1991,aims: an adaptive interactive modeling system for supporting engineering decision making.
1991,decision tree induction of 3-d manufacturing features.
1991,knowledge acquisition combining analytical and empirrcal techniques.
1992,generalizing from case studies: a case study.
1992,on learning more concepts.
1992,the principal axes method for constructive induction.
1992,learning by incomplete explanation-based learning.
1992,trading off consistency and efficiency in version-space induction.
1992,peepholing: choosing attributes efficiently for megainduction.
1992,improving path planning with learning.
1992,the right representation for discovery: finding the conservation of momentum.
1992,learning to predict in uncertain continuous tasks.
1992,lazy partial evaluation: an integration of explanation-based generalization and partial evaluation.
1992,a teaching method for reinforcement learning.
1992,spatial analogy and subsumption.
1992,learning to satisfy conjunctive goals.
1992,multistrategy learning with introspective meta-explanations.
1992,an asymptotic analysis of speedup learning.
1992,why ebl produces overly-specific knowledge: a critique of the prodigy approaches.
1992,automatic feature generation for problem solving systems.
1992,towards inductive generalization in higher order logic.
1992,ordering effects in clustering.
1992,learning structured concepts using genetic algorithms.
1992,an analysis of learning to plan as a search problem.
1992,an approach to anytime learning.
1992,artificial universes - towards a systematic approach to evaluation algorithms which learn form examples.
1992,average case analysis of learning kappa-cnf concepts.
1992,the mentle approach to learning heuristics for the control of logic programs.
1992,fuzzy substructure discovery.
1992,"efficient classification of massive, unsegmented datastreams."
1992,induction of one-level decision trees.
1992,combining competition and cooperation in supervised inductive learning.
1992,a practical approach to feature selection.
1992,learning as optimization: stochastic generation of multiple knowledge.
1992,dynamic optimization.
1992,sub-unification: a tool for efficient induction of recursive programs.
1992,augmenting and efficiently utilizing domain theory in explanation-based natural language acquisition.
1992,enhancing transfer in reinforcement learning by building stochastic models of robot actions.
1992,thought: an integrated learning system for acquiring knowledge structure.
1992,an approach to concept learning based on term generalization.
1992,using transitional proximity for faster reinforcement learning.
1992,nfdt: a system that learns flexible concepts based on decision trees for numerical attributes.
1992,a symbolic algorithm for computing coefficients' accuracy in regression.
1992,"compression, significance, and accuracy."
1992,guiding example acquisition by generating scenarios.
1992,constructive induction using a non-greedy strategy for feature selection.
1992,training second-order recurrent neural networks using hints.
1992,dynamic: a new role for training problems in ebl.
1992,a framework for discovering discrete event models.
1992,learning episodes for optimization.
1992,learning to fly.
1992,deconstructing the digit recognition problem.
1992,on combining multiple speedup techniques.
1992,scaling reinforcement learning algorithms by learning variable temporal resolution models.
1992,detecting novel classes with applications to fault diagnosis.
1992,measuring utility and the design of provably good ebl algorithms.
1992,refining a relational theory with multiple faults in the concept and subconcepts.
1992,cooperation in knowledge base refinement.
