Year,Title
2006,nightmare at test time: robust learning by feature deletion.
2006,a choice model with infinitely many latent features.
2006,connectionist temporal classification: labelling unsegmented sequence data with recurrent neural networks.
2006,practical solutions to the problem of diagonal dominance in kernel document clustering.
2006,fast transpose methods for kernel learning on sparse data.
2006,an analysis of graph cut size for transductive learning.
2006,learning a kernel function for classification with small training samples.
2006,looping suffix tree-based inference of partially observable hidden state.
2006,batch mode active learning and its application to medical image classification.
2006,ranking individuals by group comparisons.
2006,hidden process models.
2006,estimating relatedness via data compression.
2006,automatic basis function construction for approximate dynamic programming and reinforcement learning.
2006,personalized handwriting recognition via biased regularization.
2006,optimal kernel selection in kernel fisher discriminant analysis.
2006,pareto optimal linear classification.
2006,fast particle smoothing: if i had a million particles.
2006,autonomous shaping: knowledge transfer in reinforcement learning.
2006,data association for topic intensity tracking.
2006,learning low-rank kernel matrices.
2006,local distance preservation in the gp-lvm through back constraints.
2006,simpler knowledge-based support vector machines.
2006,using query-specific variance estimates to combine bayesian classifiers.
2006,a probabilistic model for text kernels.
2006,efficient map approximation for dense energy functions.
2006,nonstationary kernel combination.
2006,region-based value iteration for partially observable markov decision processes.
2006,multiclass boosting with repartitioning.
2006,pachinko allocation: dag-structured mixture models of topic correlations.
2006,spectral clustering for multi-type relational data.
2006,combined central and subspace clustering for computer vision applications.
2006,fast direct policy evaluation using multiscale analysis of markov diffusion processes.
2006,pruning in ordered bagging ensembles.
2006,learning high-order mrf priors of color images.
2006,the uniqueness of a good optimum for k-means.
2006,kernel information embeddings.
2006,generalized spectral bounds for sparse lda.
2006,learning to impersonate.
2006,online decoding of markov models under latency constraints.
2006,learning hierarchical task networks by observation.
2006,reinforcement learning for optimized trade execution.
2006,concept boundary detection for speeding up svms.
2006,the support vector decomposition machine.
2006,an analytic solution to discrete bayesian reinforcement learning.
2006,missl: multiple-instance semi-supervised learning.
2006,constructing informative priors using transfer learning.
2006,cn = cpcn.
2006,maximum margin planning.
2006,quadratic programming relaxations for metric labeling and markov random field map estimation.
2006,categorization in multiple category systems.
2006,how boosting the margin can also boost classifier complexity.
2006,combining discriminative features to infer complex trajectories.
2006,sequential update of adtrees.
2006,predictive linear-gaussian models of controlled stochastic dynamical systems.
2006,a statistical approach to rule learning.
2006,efficient inference on sequence segmentation models.
2006,cost-sensitive learning with conditional markov networks.
2006,feature value acquisition in testing: a sequential batch test algorithm.
2006,permutation invariant svms.
2006,bayesian learning of measurement and structural models.
2006,an intrinsic reward mechanism for efficient exploration.
2006,deterministic annealing for semi-supervised kernel machines.
2006,feature subset selection bias for classification learning.
2006,classifying eeg for brain-computer interfaces: learning optimal filters for dynamical system features.
2006,an investigation of computational and informational limits in gaussian mixture clustering.
2006,bayesian pattern ranking for move prediction in the game of go.
2006,pac model-free reinforcement learning.
2006,experience-efficient learning in associative bandit problems.
2006,full bayesian network classifiers.
2006,local fisher discriminant analysis for supervised dimensionality reduction.
2006,iterative relief for feature weighting.
2006,multiclass reduced-set support vector machines.
2006,fast and space efficient string kernels using suffix arrays.
2006,bayesian regression with input noise for high dimensional data.
2006,probabilistic inference for solving discrete and continuous state markov decision processes.
2006,clustering graphs by weighted substructure mining.
2006,active sampling for detecting irrelevant features.
2006,accelerated training of conditional random fields with stochastic gradient methods.
2006,topic modeling: beyond bag-of-words.
2006,label propagation through linear neighborhoods.
2006,two-dimensional solution path for support vector regression.
2006,totally corrective boosting algorithms that maximize the margin.
2006,inference with the universum.
2006,kernel predictive linear gaussian models for nonlinear stochastic dynamical systems.
2006,predictive state representations with options.
2006,fast time series classification using numerosity reduction.
2006,a duality view of spectral methods for dimensionality reduction.
2006,bayesian multi-population haplotype inference via a hierarchical dirichlet process mixture.
2006,discriminative unsupervised learning of structured predictors.
2006,semi-supervised nonlinear dimensionality reduction.
2006,null space versus orthogonal linear discriminant analysis.
2006,active learning via transductive experimental design.
2006,collaborative ordinal regression.
2006,block-quantized kernel matrix for fast spectral embedding.
2006,statistical debugging: simultaneous identification of multiple bugs.
2006,efficient lazy elimination for averaged one-dependence estimators.
2007,quantum clustering algorithms.
2007,learning random walks to rank nodes in graphs.
2007,uncovering shared structures in multiclass classification.
2007,two-view feature generation model for semi-supervised learning.
2007,scalable training of l1-regularized log-linear models.
2007,multiclass core vector machine.
2007,the rendezvous algorithm: multiclass semi-supervised learning with markov random walks.
2007,focused crawling with scalable ordinal regression solvers.
2007,learning distance function by coding similarity.
2007,structural alignment based kernels for protein structure classification.
2007,discriminative learning for differing training and test distributions.
2007,solving multiclass support vector machines with larank.
2007,efficiently computing minimax expected-size confidence regions.
2007,multiple instance learning for sparse positive bags.
2007,cluster analysis of heterogeneous rank data.
2007,feature selection in a kernel space.
2007,learning to rank: from pairwise approach to listwise approach.
2007,local similarity discriminant analysis.
2007,direct convex relaxations of sparse svm.
2007,minimum reference set based feature selection for small sample classifications.
2007,learning to compress images and videos.
2007,magnitude-preserving ranking algorithms.
2007,full regularization path for sparse principal component analysis.
2007,kernel selection forl semi-supervised kernel machines.
2007,boosting for transfer learning.
2007,intractability and clustering with constraints.
2007,information-theoretic metric learning.
2007,an integrated approach to feature invention and model construction for drug activity prediction.
2007,percentile optimization in uncertain markov decision processes with application to efficient exploration.
2007,unsupervised prediction of citation influences.
2007,non-isometric manifold learning: analysis and an algorithm.
2007,hierarchical maximum entropy density estimation.
2007,carpediem: an algorithm for the fast evaluation of ssl classifiers.
2007,manifold-adaptive dimension estimation.
2007,combining online and offline knowledge in uct.
2007,robust non-linear dimensionality reduction using successive 1-dimensional laplacian eigenmaps.
2007,gradient boosting for kernelized output spaces.
2007,bayesian actor-critic algorithms.
2007,exponentiated gradient algorithms for log-linear structured prediction.
2007,best of both: a hybridized centroid-medoid clustering heuristic.
2007,recovering temporally rewiring networks: a model-based approach.
2007,efficient inference with cardinality-based clique potentials.
2007,sparse probabilistic classifiers.
2007,supervised clustering of streaming data for email batch detection.
2007,a bound on the label complexity of agnostic active learning.
2007,learning nonparametric kernel matrices from pairwise constraints.
2007,parameter learning for relational bayesian networks.
2007,bayesian compressive sensing and projection optimization.
2007,constructing basis functions from directed graphs for value function approximation.
2007,most likely heteroscedastic gaussian process regression.
2007,neighbor search with global geometry: a minimax message passing algorithm.
2007,a recursive method for discriminative mixture learning.
2007,infinite mixtures of trees.
2007,local dependent components.
2007,statistical predicate invention.
2007,"kernelizing pls, degrees of freedom, and efficient model selection."
2007,nonmyopic active learning of gaussian processes: an exploration-exploitation approach.
2007,on one method of non-diagonal regularization in sparse bayesian learning.
2007,online kernel pca with entropic matrix updates.
2007,an empirical evaluation of deep architectures on problems with many factors of variation.
2007,hierarchical gaussian process latent variable models.
2007,learning a meta-level prior for feature relevance from multiple related tasks.
2007,scalable modeling of real graphs using kronecker multiplication.
2007,support cluster machine.
2007,a transductive framework of distance metric learning by spectral dimensionality reduction.
2007,adaptive dimension reduction using discriminant analysis and k-means clustering.
2007,large-scale rlsc learning without agony.
2007,a novel orthogonal nmf-based belief compression for pomdps.
2007,a permutation-augmented sampler for dp mixture models.
2007,quadratically gated mixture of experts for incomplete data classification.
2007,trust region newton methods for large-scale logistic regression.
2007,relational clustering by symmetric convex coding.
2007,discriminant analysis in correlation similarity measure space.
2007,adaptive mesh compression in 3d computer graphics using multiscale manifold learning.
2007,"simple, robust, scalable semi-supervised learning via expectation regularization."
2007,automatic shaping and decomposition of reward functions.
2007,asymmetric boosting.
2007,linear and nonlinear generative probabilistic class models for shape contours.
2007,bottom-up learning of markov logic network structure.
2007,mixtures of hierarchical topics with pachinko allocation.
2007,three new graphical models for statistical language modelling.
2007,fast and effective kernels for relational learning from texts.
2007,dimensionality reduction and generalization.
2007,unsupervised estimation for noisy-channel models.
2007,revisiting probabilistic models for clustering with pair-wise constraints.
2007,comparisons of sequence labeling algorithms and extensions.
2007,multi-task learning for sequential data via ihmms and the nested dirichlet process.
2007,regression on manifolds using kernel dimension reduction.
2007,learning state-action basis functions for hierarchical mdps.
2007,a fast linear separability test by projection of positive points on subspaces.
2007,multi-armed bandit problems with dependent arms.
2007,learning for efficient retrieval of structured data with noisy queries.
2007,analyzing feature generation for value-function approximation.
2007,reinforcement learning by reward-weighted regression for operational space control.
2007,tracking value function dynamics to improve reinforcement learning with piecewise linear function approximation.
2007,self-taught learning: transfer learning from unlabeled data.
2007,online discovery of similarity mappings.
2007,more efficiency in multiple kernel learning.
2007,graph clustering with network structure indices.
2007,restricted boltzmann machines for collaborative filtering.
2007,sample compression bounds for decision trees.
2007,pegasos: primal estimated sub-gradient solver for svm.
2007,a dependence maximization view of clustering.
2007,supervised feature selection via dependence estimation.
2007,sparse eigen methods by d.c. programming.
2007,learning to solve game trees.
2007,robust mixtures in the presence of measurement errors.
2007,a kernel-based causal learning algorithm.
2007,piecewise pseudolikelihood for efficient training of conditional random fields.
2007,on the role of tracking in stationary environments.
2007,cross-domain transfer for reinforcement learning.
2007,incremental bayesian networks for structure prediction.
2007,classifying matrices with a spectral regularization.
2007,approximate maximum margin algorithms with rules controlled by the number of mistakes.
2007,simpler core vector machines with enclosing balls.
2007,entire regularization paths for graph data.
2007,discriminative gaussian process latent variable model for classification.
2007,experimental perspectives on learning from imbalanced data.
2007,learning from interpretations: a rooted kernel for ordered hypergraphs.
2007,a kernel path algorithm for support vector machines.
2007,dirichlet aggregation: unsupervised learning towards an optimal metric for proportional data.
2007,transductive regression piloted by inter-manifold relations.
2007,multifactor gaussian process models for style-content separation.
2007,hybrid huberized support vector machines for microarray classification.
2007,on learning with dissimilarity functions.
2007,winnowing subspaces.
2007,what is decreased by the max-sum arc consistency algorithm?
2007,multi-task reinforcement learning: a hierarchical bayesian approach.
2007,beamforming using the relevance vector machine.
2007,learning to combine distances for complex representations.
2007,local learning projections.
2007,on learning linear ranking functions for beam search.
2007,modeling changing dependency structure in multivariate time series.
2007,the matrix stick-breaking process for flexible multi-task learning.
2007,map building without localization by dimensionality reduction techniques.
2007,asymptotic bayesian generalization error when training and test distributions are different.
2007,least squares linear discriminant analysis.
2007,discriminant kernel and regularization parameter learning via semidefinite programming.
2007,robust multi-task learning with t-processes.
2007,on the value of pairwise constraints in classification and consistency.
2007,maximum margin clustering made practical.
2007,nonlinear independent component analysis with minimal nonlinear distortion.
2007,optimal dimensionality of metric space for classification.
2007,conditional random fields for multi-agent reinforcement learning.
2007,spectral feature selection for supervised and unsupervised learning.
2007,spectral clustering and transductive learning with multiple views.
2007,on the relation between multi-instance learning and semi-supervised learning.
2007,dynamic hierarchical markov random fields and their application to web data extraction.
2007,transductive support vector machines for structured variables.
2007,multiclass multiple kernel learning.
2008,gaussian process product models for nonparametric nonstationarity.
2008,sequence kernels for predicting protein essentiality.
2008,hierarchical kernel stick-breaking process for multi-task image analysis.
2008,graph kernels between point clouds.
2008,bolasso: model consistent lasso estimation through the bootstrap.
2008,learning all optimal policies with multiple criteria.
2008,multiple instance ranking.
2008,multi-task learning for hiv therapy screening.
2008,nonnegative matrix factorization via rank-one downdate.
2008,strategy evaluation in extensive games with importance sampling.
2008,actively learning level-sets of composite functions.
2008,sparse bayesian nonparametric regression.
2008,an empirical evaluation of supervised learning in high dimensions.
2008,fast support vector machine training and classification on graphics processors.
2008,fast nearest neighbor retrieval for bregman divergences.
2008,nearest hyperdisk methods for high-dimensional classification.
2008,learning to sportscast: a test of grounded language acquisition.
2008,training svm with indefinite kernels.
2008,learning for control from multiple demonstrations.
2008,spectral clustering with inconsistent advice.
2008,a unified architecture for natural language processing: deep neural networks with multitask learning.
2008,autonomous geometric precision error estimation in low-level computer vision tasks.
2008,stability of transductive regression algorithms.
2008,a rate-distortion one-class model and its applications to clustering.
2008,fast gaussian process methods for point process intensity estimation.
2008,self-taught clustering.
2008,hierarchical sampling for active learning.
2008,learning to classify with missing and corrupted features.
2008,maximum likelihood rule ensembles.
2008,learning from incomplete data with infinite imputations.
2008,an object-oriented representation for efficient reinforcement learning.
2008,optimizing estimated loss reduction for active sampling in rank learning.
2008,reinforcement learning with limited reinforcement: using bayes risk for active learning in pomdps.
2008,confidence-weighted linear classification.
2008,efficient projections onto the l1-ball for learning in high dimensions.
2008,pointwise exact bootstrap distributions of cost curves.
2008,polyhedral classifier for target detection: a case study: colorectal cancer.
2008,active reinforcement learning.
2008,training structural svms when exact inference is intractable.
2008,an hdp-hmm for systems with state persistence.
2008,optimized cutting plane algorithm for support vector machines.
2008,stopping conditions for exact computation of leave-one-out error in support vector machines.
2008,reinforcement learning in the presence of rare events.
2008,memory bounded inference in topic models.
2008,localized multiple kernel learning.
2008,no-regret learning in convex games.
2008,boosting with incomplete information.
2008,grassmann discriminant analysis: a unifying view on subspace-based learning.
2008,modified mmi/mpe: a direct evaluation of the margin in speech recognition.
2008,statistical models for partial membership.
2008,active kernel learning.
2008,a dual coordinate descent method for large-scale linear svm.
2008,discriminative structure and parameter learning for markov logic networks.
2008,causal modelling combining instantaneous and lagged effects: an identifiable model based on non-gaussianity.
2008,efficient bandit algorithms for online multiclass prediction.
2008,large scale manifold transduction.
2008,non-parametric policy gradients: a unified treatment of propositional and relational domains.
2008,ica and isa using schweizer-wolff measure of dependence.
2008,unsupervised rank aggregation with distance-based models.
2008,on partial optimality in multi-label mrfs.
2008,space-indexed dynamic programming: learning to follow trajectories.
2008,the skew spectrum of graphs.
2008,fast estimation of first-order clause coverage through randomization and maximum likelihood.
2008,query-level stability and generalization in learning to rank.
2008,modeling interleaved hidden processes.
2008,exploration scavenging.
2008,classification using discriminative restricted boltzmann machines.
2008,transfer of samples in batch reinforcement learning.
2008,local likelihood modeling of temporal text streams.
2008,a worst-case comparison between temporal difference and residual gradient with linear function approximation.
2008,knows what it knows: a framework for self-aware learning.
2008,pairwise constraint propagation by semidefinite programming for semi-supervised classification.
2008,"an asymptotic analysis of generative, discriminative, and pseudolikelihood estimators."
2008,structure compilation: trading structure for features.
2008,"manifoldboost: stagewise function approximation for fully-, semi- and un-supervised learning."
2008,random classification noise defeats all convex potential boosters.
2008,uncorrelated multilinear principal component analysis through successive variance maximization.
2008,a reproducing kernel hilbert space framework for pairwise time series distances.
2008,on-line discovery of temporal-difference networks.
2008,nonextensive entropic kernels.
2008,automatic discovery and transfer of maxq hierarchies.
2008,rank minimization via online learning.
2008,an analysis of reinforcement learning with function approximation.
2008,empirical bernstein stopping.
2008,efficiently solving convex relaxations for map estimation.
2008,on the hardness of finding symmetries in markov decision processes.
2008,bayes optimal classification for decision trees.
2008,a decoupled approach to exemplar-based unsupervised learning.
2008,cost-sensitive multi-class classification from probability estimates.
2008,the projectron: a bounded kernel-based perceptron.
2008,learning dissimilarities by ranking: from sdp to qp.
2008,a distance model for rhythms.
2008,on the chance accuracies of large collections of classifiers.
2008,"an analysis of linear models, linear value-function approximation, and feature selection for reinforcement learning."
2008,learning to learn implicit queries from gaze patterns.
2008,multi-task compressive sensing with dirichlet process priors.
2008,estimating labels from label proportions.
2008,learning diverse rankings with multi-armed bandits.
2008,semi-supervised learning of compact document representations with deep networks.
2008,"message-passing for graph-structured linear programs: proximal projections, convergence and rounding schemes."
2008,bayesian multiple instance learning: automatic feature selection and inductive transfer.
2008,online kernel selection for bayesian reinforcement learning.
2008,the dynamic hierarchical dirichlet process.
2008,closed-form supervised dimensionality reduction with generalized linear models.
2008,bi-level path following for cross validated solution of kernel quantile regression.
2008,the group-lasso for generalized linear models: uniqueness of solutions and efficient algorithms.
2008,robust matching and recognition using context-dependent kernels.
2008,privacy-preserving reinforcement learning.
2008,on the quantitative analysis of deep belief networks.
2008,bayesian probabilistic matrix factorization using markov chain monte carlo.
2008,accurate max-margin training for structured output spaces.
2008,fast incremental proximity search in large graphs.
2008,inverting the viterbi algorithm: an abstract framework for structure design.
2008,compressed sensing and bayesian experimental design.
2008,multi-classification by categorical features via clustering.
2008,svm optimization: inverse dependence on training set size.
2008,data spectroscopy: learning mixture models using eigenspaces of convolution operators.
2008,a generalization of haussler's convolution kernel: mapping kernel.
2008,mstruct: a new admixture model for inference of population structure in light of both genetic admixing and allele mutations.
2008,expectation-maximization for sparse and non-negative pca.
2008,sample-based learning and search with permanent and transient memories.
2008,an rkhs for multi-view learning and manifold co-regularization.
2008,the asymptotics of semi-supervised learning in discriminative probabilistic models.
2008,tailoring density estimation via reproducing kernel moment matching.
2008,detecting statistical interactions with additive groves of trees.
2008,metric embedding for kernel classification rules.
2008,discriminative parameter learning for bayesian networks.
2008,a least squares formulation for canonical correlation analysis.
2008,apprenticeship learning using linear programming.
2008,composite kernel learning.
2008,the many faces of optimism: a unifying approach.
2008,nu-support vector machine as conditional value-at-risk minimization.
2008,training restricted boltzmann machines using approximations to the likelihood gradient.
2008,a semiparametric statistical approach to model-free policy evaluation.
2008,topologically-constrained latent variable models.
2008,beam sampling for the infinite hidden markov model.
2008,extracting and composing robust features with denoising autoencoders.
2008,prediction with expert advice for the brier game.
2008,sparse multiscale gaussian process regression.
2008,manifold alignment using procrustes analysis.
2008,dirichlet component analysis: feature extraction for compositional data.
2008,adaptive p-posterior mixture-model kernels for multiple instance learning.
2008,graph transduction via alternating minimization.
2008,on multi-view active learning and the combination with semi-supervised learning.
2008,fast solvers and efficient implementations for distance metric learning.
2008,deep learning via semi-supervised embedding.
2008,efficiently learning linear-linear exponential family predictive representations of state.
